"title","url","price"
"Fehu00E9r MissQ Inviting Words Blu00FAz","http://starshiners.hu/bluzok/feher-missq-inviting-words-bluz",10990.0
"Fekete MissQ Inviting Words Blu00FAz","http://starshiners.hu/bluzok/fekete-missq-inviting-words-bluz",10990.0
"Fekete MissQ Catchy Face Blu00FAz","http://starshiners.hu/bluzok/fekete-missq-catchy-face-bluz",16490.0
"Fehu00E9r LaDonna Delicious Soul Blu00FAz","http://starshiners.hu/bluzok/feher-ladonna-delicious-soul-bluz",11490.0
"Piros LaDonna Delicious Soul Blu00FAz","http://starshiners.hu/bluzok/piros-ladonna-delicious-soul-bluz",11490.0
"Kru00E9m LaDonna Delicious Soul Blu00FAz","http://starshiners.hu/bluzok/krem-ladonna-delicious-soul-bluz",11490.0
"Lila Precious Style Blu00FAz","http://starshiners.hu/bluzok/lila-precious-style-bluz",15990.0
"Lila LaDonna Delicious Soul Blu00FAz","http://starshiners.hu/bluzok/lila-ladonna-delicious-soul-bluz",11490.0
"Piros Fascinating Rush Blu00FAz","http://starshiners.hu/bluzok/piros-fascinating-rush-bluz",15990.0
"Fehu00E9r Marvelous Look Blu00FAz","http://starshiners.hu/bluzok/feher-marvelous-look-bluz",15990.0
"Fehu00E9r Deep Reflection Blu00FAz","http://starshiners.hu/bluzok/feher-deep-reflection-bluz",16790.0
"Fehu00E9r Sublime Chain Blu00FAz","http://starshiners.hu/bluzok/feher-sublime-chain-bluz",15990.0
"Piros Catchy Attitude Blu00FAz","http://starshiners.hu/bluzok/piros-catchy-attitude-bluz",15990.0
"Ku00E9k Lovely Allure Blu00FAz","http://starshiners.hu/bluzok/kek-lovely-allure-bluz",15990.0
"Lila Fascinating Touch Blu00FAz","http://starshiners.hu/bluzok/lila-fascinating-touch-bluz",16790.0
"Piros Delicate Behave Blu00FAz","http://starshiners.hu/bluzok/piros-delicate-behave-bluz",16990.0
"Fekete Tender Dream Blu00FAz","http://starshiners.hu/bluzok/fekete-tender-dream-bluz",16790.0
"Ku00E9k Delicate Behave Blu00FAz","http://starshiners.hu/bluzok/kek-delicate-behave-bluz",16990.0
"Su00F6tu00E9tku00E9k Delicate Behave Blu00FAz","http://starshiners.hu/bluzok/sotetkek-delicate-behave-bluz",16990.0
"Fekete Pleasant Fantasy Blu00FAz","http://starshiners.hu/bluzok/fekete-pleasant-fantasy-bluz",16990.0
"Piros Pleasant Fantasy Blu00FAz","http://starshiners.hu/bluzok/piros-pleasant-fantasy-bluz",16990.0
"Fehu00E9r Vintage Glamour Blu00FAz","http://starshiners.hu/bluzok/feher-vintage-glamour-bluz",16990.0
"Fehu00E9r Fabulous Simplicity Blu00FAz","http://starshiners.hu/bluzok/feher-fabulous-simplicity-bluz",18890.0
"Nude Charming Heritage Blu00FAz","http://starshiners.hu/bluzok/nude-charming-heritage-bluz",16990.0
"Fehu00E9r Romantic Imagine Blu00FAz","http://starshiners.hu/bluzok/feher-romantic-imagine-bluz",18890.0
"Fehu00E9r Bohemian Spirit Blu00FAz","http://starshiners.hu/bluzok/feher-bohemian-spirit-bluz",16990.0
"Zu00F6ld Lovely Wanderer Blu00FAz","http://starshiners.hu/bluzok/zold-lovely-wanderer-bluz",8390.0
"Ku00E9k Lovely Wanderer Blu00FAz","http://starshiners.hu/bluzok/kek-lovely-wanderer-bluz",8390.0
"Su00E1rga Lovely Wanderer Blu00FAz","http://starshiners.hu/bluzok/sarga-lovely-wanderer-bluz",8390.0
"Su00F6tu00E9tzu00F6ld Blissful Touch Blu00FAz","http://starshiners.hu/bluzok/sotetzold-blissful-touch-bluz",15890.0
"Lila Lovely Wanderer Blu00FAz","http://starshiners.hu/bluzok/lila-lovely-wanderer-bluz",8390.0
"Zu00F6ld Blissful Touch Blu00FAz","http://starshiners.hu/bluzok/zold-blissful-touch-bluz",15890.0
"Fehu00E9r PrettyGirl Majestic Blu00FAz","http://starshiners.hu/bluzok/feher-prettygirl-majestic-bluz",6390.0
"Fekete Natural Feminity Blu00FAz","http://starshiners.hu/bluzok/fekete-natural-feminity-bluz",16790.0
"Zu00F6ld Natural Feminity Blu00FAz","http://starshiners.hu/bluzok/zold-natural-feminity-bluz",16790.0
"Fehu00E9r PrettyGirl Wonderfull Blu00FAz","http://starshiners.hu/bluzok/feher-prettygirl-wonderfull-bluz",6390.0
"Su00F6tu00E9tku00E9k LaDonna Frilled Sleeves Blu00FAz","http://starshiners.hu/bluzok/sotetkek-ladonna-frilled-sleeves-bluz",6490.0
"Fehu00E9r LaDonna Frilled Sleeves Blu00FAz","http://starshiners.hu/bluzok/feher-ladonna-frilled-sleeves-bluz",6490.0
"Szu00FCrke PrettyGirl Goodwill Blu00FAz","http://starshiners.hu/bluzok/szurke-prettygirl-goodwill-bluz",6390.0
"Fehu00E9r PrettyGirl Affinity Blu00FAz","http://starshiners.hu/bluzok/feher-prettygirl-affinity-bluz",7190.0
"Su00F6tu00E9tku00E9k LaDonna Simple Pick Blu00FAz","http://starshiners.hu/bluzok/sotetkek-ladonna-simple-pick-bluz",6390.0
"Ru00F3zsaszu00EDnu0171 PrettyGirl Affinity Blu00FAz","http://starshiners.hu/bluzok/rozsaszinu-prettygirl-affinity-bluz",7190.0
"Barackviru00E1gszu00EDnu0171 Artista Great Angle Blu00FAz","http://starshiners.hu/bluzok/barackviragszinu-artista-great-angle-bluz",9090.0
"Fehu00E9r Artista Great Angle Blu00FAz","http://starshiners.hu/bluzok/feher-artista-great-angle-bluz",9090.0
"Fekete LaDonna Summer Desire Blu00FAz","http://starshiners.hu/bluzok/fekete-ladonna-summer-desire-bluz",6990.0
"Ru00F3zsaszu00EDnu0171 StarShinerS Hu00EDmzett Lovable Blu00FAz","http://starshiners.hu/bluzok/rozsaszinu-starshiners-himzett-lovable-bluz",18490.0
"Su00E1rga LaDonna Summer Desire Blu00FAz","http://starshiners.hu/bluzok/sarga-ladonna-summer-desire-bluz",6990.0
"Ku00E9k LaDonna Summer Desire Blu00FAz","http://starshiners.hu/bluzok/kek-ladonna-summer-desire-bluz",6990.0
"Barna MissQ Unique Burst Blu00FAz","http://starshiners.hu/bluzok/barna-missq-unique-burst-bluz",16990.0
"Ku00E9k PrettyGirl Childish Blu00FAz","http://starshiners.hu/bluzok/kek-prettygirl-childish-bluz",8390.0
"Zu00F6ld PrettyGirl Childish Blu00FAz","http://starshiners.hu/bluzok/zold-prettygirl-childish-bluz",8390.0
"Pink PrettyGirl Childish Blu00FAz","http://starshiners.hu/bluzok/pink-prettygirl-childish-bluz",8390.0
"Su00F6tu00E9tku00E9k PrettyGirl Childish Blu00FAz","http://starshiners.hu/bluzok/sotetkek-prettygirl-childish-bluz",8390.0
"Barna PrettyGirl Abstraction Blu00FAz","http://starshiners.hu/bluzok/barna-prettygirl-abstraction-bluz",9890.0
"Ku00E9k StarShinerS Specially Blu00FAz","http://starshiners.hu/bluzok/kek-starshiners-specially-bluz",14290.0
"Su00F6tu00E9tku00E9k StarShinerS Specially Blu00FAz","http://starshiners.hu/bluzok/sotetkek-starshiners-specially-bluz",14290.0
"Zu00F6ld MissQ Gilly Flowers Blu00FAz","http://starshiners.hu/bluzok/zold-missq-gilly-flowers-bluz",16790.0
"Barackviru00E1gszu00EDnu0171 MissQ Gilly Flowers Blu00FAz","http://starshiners.hu/bluzok/barackviragszinu-missq-gilly-flowers-bluz",16790.0
"Korall LaDonna Celebrates Life Blu00FAz","http://starshiners.hu/bluzok/korall-ladonna-celebrates-life-bluz",8290.0
"Piros PrettyGirl Stillness Blu00FAz","http://starshiners.hu/bluzok/piros-prettygirl-stillness-bluz",6790.0
"Tu00FCrkiz PrettyGirl Stillness Blu00FAz","http://starshiners.hu/bluzok/turkiz-prettygirl-stillness-bluz",6790.0
"Piros PrettyGirl Simplicity Blu00FAz","http://starshiners.hu/bluzok/piros-prettygirl-simplicity-bluz",7490.0
"Barackviru00E1gszu00EDnu0171 PrettyGirl Simplicity Blu00FAz","http://starshiners.hu/bluzok/barackviragszinu-prettygirl-simplicity-bluz",7490.0
"Su00E1rga Artista Honest Look Blu00FAz","http://starshiners.hu/bluzok/sarga-artista-honest-look-bluz",6892.5
"Fehu00E9r PrettyGirl Dressable Blu00FAz","http://starshiners.hu/bluzok/feher-prettygirl-dressable-bluz",8990.0
"Piros PrettyGirl Lace Type Blu00FAz","http://starshiners.hu/bluzok/piros-prettygirl-lace-type-bluz",9790.0
"Fekete Artista Middle Ribbon Blu00FAz","http://starshiners.hu/bluzok/fekete-artista-middle-ribbon-bluz",6967.5
"Barna PrettyGirl Jolly Month Blu00FAz","http://starshiners.hu/bluzok/barna-prettygirl-jolly-month-bluz",9790.0
"Pink Artista Middle Ribbon Blu00FAz","http://starshiners.hu/bluzok/pink-artista-middle-ribbon-bluz",6967.5
"Fehu00E9r Artista Middle Ribbon Blu00FAz","http://starshiners.hu/bluzok/feher-artista-middle-ribbon-bluz",6967.5
"Szu00FCrke PrettyGirl Springlike Blu00FAz","http://starshiners.hu/bluzok/szurke-prettygirl-springlike-bluz",9890.0
"Barna PrettyGirl Springlike Blu00FAz","http://starshiners.hu/bluzok/barna-prettygirl-springlike-bluz",9890.0
"Mint Artista Middle Ribbon Blu00FAz","http://starshiners.hu/bluzok/mint-artista-middle-ribbon-bluz",6245.63
"Kru00E9m LaDonna Cute Dots Blu00FAz","http://starshiners.hu/bluzok/krem-ladonna-cute-dots-bluz",9590.0
"Fehu00E9r Artista Major Look Blu00FAz","http://starshiners.hu/bluzok/feher-artista-major-look-bluz",8017.5
"Ru00F3zsaszu00EDnu0171 LaDonna Cute Dots Blu00FAz","http://starshiners.hu/bluzok/rozsaszinu-ladonna-cute-dots-bluz",9590.0
"Fekete Artista Major Look Blu00FAz","http://starshiners.hu/bluzok/fekete-artista-major-look-bluz",6780.91
"Piros Artista Major Look Blu00FAz","http://starshiners.hu/bluzok/piros-artista-major-look-bluz",6780.91
"Su00F6tu00E9tzu00F6ld PrettyGirl Printed Blu00FAz","http://starshiners.hu/bluzok/sotetzold-prettygirl-printed-bluz",9890.0
"Fekete PrettyGirl Resolute Blu00FAz","http://starshiners.hu/bluzok/fekete-prettygirl-resolute-bluz",8490.0
"Kru00E9m PrettyGirl Printed Blu00FAz","http://starshiners.hu/bluzok/krem-prettygirl-printed-bluz",9890.0
"Kru00E9m PrettyGirl Resolute Blu00FAz","http://starshiners.hu/bluzok/krem-prettygirl-resolute-bluz",8490.0
"Lila PrettyGirl Resolute Blu00FAz","http://starshiners.hu/bluzok/lila-prettygirl-resolute-bluz",8490.0
"Piros PrettyGirl Resolute Blu00FAz","http://starshiners.hu/bluzok/piros-prettygirl-resolute-bluz",8490.0
"Fekete Eccentric Space Blu00FAz","http://starshiners.hu/bluzok/fekete-eccentric-space-bluz",8406.5
"Barna MissQ Generous Look Blu00FAz","http://starshiners.hu/bluzok/barna-missq-generous-look-bluz",12290.0
"Su00F6tu00E9tku00E9k StarShinerS Heritage Blu00FAz","http://starshiners.hu/bluzok/sotetkek-starshiners-heritage-bluz",14990.0
"Ru00F3zsaszu00EDnu0171 Fashionable Bow Blu00FAz","http://starshiners.hu/bluzok/rozsaszinu-fashionable-bow-bluz",9890.0
"Ku00E9k Fashionable Bow Blu00FAz","http://starshiners.hu/bluzok/kek-fashionable-bow-bluz",9890.0
"Piros LaDonna Tearfully Lace Blu00FAz","http://starshiners.hu/bluzok/piros-ladonna-tearfully-lace-bluz",8790.0
"Nude LaDonna Tearfully Lace Blu00FAz","http://starshiners.hu/bluzok/nude-ladonna-tearfully-lace-bluz",8790.0
"Fekete PrettyGirl Queenly Blu00FAz","http://starshiners.hu/bluzok/fekete-prettygirl-queenly-bluz",6890.0
"Ku00E9k LaDonna Tearfully Lace Blu00FAz","http://starshiners.hu/bluzok/kek-ladonna-tearfully-lace-bluz",8790.0
"Lila PrettyGirl Queenly Blu00FAz","http://starshiners.hu/bluzok/lila-prettygirl-queenly-bluz",6890.0
"Burgundy PrettyGirl Curiosity Blu00FAz","http://starshiners.hu/bluzok/burgundy-prettygirl-curiosity-bluz",7290.0
"Fekete PrettyGirl Cordiality Blu00FAz","http://starshiners.hu/bluzok/fekete-prettygirl-cordiality-bluz",8690.0
"Zu00F6ld PrettyGirl Cordiality Blu00FAz","http://starshiners.hu/bluzok/zold-prettygirl-cordiality-bluz",8690.0
"Lila PrettyGirl Cordiality Blu00FAz","http://starshiners.hu/bluzok/lila-prettygirl-cordiality-bluz",8690.0
"Lila PrettyGirl Cordiality Blu00FAz","http://starshiners.hu/bluzok/lila-prettygirl-cordiality-bluz",8690.0
"Fehu00E9r LaDonna Juicy View Blu00FAz","http://starshiners.hu/bluzok/feher-ladonna-juicy-view-bluz",8390.0
"Korall LaDonna Juicy View Blu00FAz","http://starshiners.hu/bluzok/korall-ladonna-juicy-view-bluz",8390.0
"Piros LaDonna Right Fantasy Blu00FAz","http://starshiners.hu/bluzok/piros-ladonna-right-fantasy-bluz",8490.0
"Su00F6tu00E9tku00E9k LaDonna Juicy View Blu00FAz","http://starshiners.hu/bluzok/sotetkek-ladonna-juicy-view-bluz",8390.0
"Tu00FCrkiz LaDonna Right Fantasy Blu00FAz","http://starshiners.hu/bluzok/turkiz-ladonna-right-fantasy-bluz",8490.0
"Nude LaDonna Right Fantasy Blu00FAz","http://starshiners.hu/bluzok/nude-ladonna-right-fantasy-bluz",8490.0
"Su00F6tu00E9tku00E9k LaDonna Right Fantasy Blu00FAz","http://starshiners.hu/bluzok/sotetkek-ladonna-right-fantasy-bluz",8490.0
"Barackviru00E1gszu00EDnu0171 LaDonna Right Fantasy Blu00FAz","http://starshiners.hu/bluzok/barackviragszinu-ladonna-right-fantasy-bluz",8490.0
"Fekete PrettyGirl Wonderful Blu00FAz","http://starshiners.hu/bluzok/fekete-prettygirl-wonderful-bluz",10290.0
"Zu00F6ld PrettyGirl Wonderful Blu00FAz","http://starshiners.hu/bluzok/zold-prettygirl-wonderful-bluz",10290.0
"Lila PrettyGirl Wonderful Blu00FAz","http://starshiners.hu/bluzok/lila-prettygirl-wonderful-bluz",7717.5
"Fekete PrettyGirl Kindly Blu00FAz","http://starshiners.hu/bluzok/fekete-prettygirl-kindly-bluz",6590.0
"Zu00F6ld PrettyGirl Kindly Blu00FAz","http://starshiners.hu/bluzok/zold-prettygirl-kindly-bluz",6590.0
"Lila PrettyGirl Kindly Blu00FAz","http://starshiners.hu/bluzok/lila-prettygirl-kindly-bluz",6590.0
"Narancs PrettyGirl Passional Blu00FAz","http://starshiners.hu/bluzok/narancs-prettygirl-passional-bluz",8890.0
"Fekete PrettyGirl Constant Blu00FAz","http://starshiners.hu/bluzok/fekete-prettygirl-constant-bluz",9590.0
"Zu00F6ld Simple Solution Blu00FAz","http://starshiners.hu/bluzok/zold-simple-solution-bluz",3390.0
"Ku00E9k PrettyGirl Passional Blu00FAz","http://starshiners.hu/bluzok/kek-prettygirl-passional-bluz",8890.0
"Nude LaDonna Adorable Harmony Blu00FAz","http://starshiners.hu/bluzok/nude-ladonna-adorable-harmony-bluz",5771.5
"Fehu00E9r LaDonna Princely Field Blu00FAz","http://starshiners.hu/bluzok/feher-ladonna-princely-field-bluz",9490.0
"Ku00E9k LaDonna Adorable Harmony Blu00FAz","http://starshiners.hu/bluzok/kek-ladonna-adorable-harmony-bluz",6790.0
"Ku00E9k LaDonna Princely Field Blu00FAz","http://starshiners.hu/bluzok/kek-ladonna-princely-field-bluz",9490.0
"Nude LaDonna Princely Field Blu00FAz","http://starshiners.hu/bluzok/nude-ladonna-princely-field-bluz",9490.0
"Fekete LaDonna High Passion Blu00FAz","http://starshiners.hu/bluzok/fekete-ladonna-high-passion-bluz",8590.0
"Piros LaDonna High Passion Blu00FAz","http://starshiners.hu/bluzok/piros-ladonna-high-passion-bluz",8590.0
"Barackviru00E1gszu00EDnu0171 LaDonna High Passion Blu00FAz","http://starshiners.hu/bluzok/barackviragszinu-ladonna-high-passion-bluz",8590.0
"Su00F6tu00E9tbarna Natural Ambition Blu00FAz","http://starshiners.hu/bluzok/sotetbarna-natural-ambition-bluz",6490.0
"Barna StarShinerS Enigmatic Blu00FAz","http://starshiners.hu/bluzok/barna-starshiners-enigmatic-bluz",14490.0
"Fekete Artista Sweet Mistery Blu00FAz","http://starshiners.hu/bluzok/fekete-artista-sweet-mistery-bluz",10590.0
"Piros Artista Floral Thrill Blu00FAz","http://starshiners.hu/bluzok/piros-artista-floral-thrill-bluz",8916.5
"Piros Artista Sweet Mistery Blu00FAz","http://starshiners.hu/bluzok/piros-artista-sweet-mistery-bluz",10590.0
"Fekete Artista Calm Allure Blu00FAz","http://starshiners.hu/bluzok/fekete-artista-calm-allure-bluz",10490.0
"Fekete Awesome Experience Blu00FAz","http://starshiners.hu/bluzok/fekete-awesome-experience-bluz",5690.0
"Szu00FCrke PrettyGirl Property Blu00FAz","http://starshiners.hu/bluzok/szurke-prettygirl-property-bluz",5990.0
"Fekete PrettyGirl Shapeless Blu00FAz","http://starshiners.hu/bluzok/fekete-prettygirl-shapeless-bluz",6152.0
"Fehu00E9r MissQ City Lights Blu00FAz","http://starshiners.hu/bluzok/feher-missq-city-lights-bluz",8992.5
"Fekete MissQ Young Carriage Blu00FAz","http://starshiners.hu/bluzok/fekete-missq-young-carriage-bluz",12990.0
"Fekete PrettyGirl Unhurried Blu00FAz","http://starshiners.hu/bluzok/fekete-prettygirl-unhurried-bluz",8990.0
"Nude PrettyGirl Unhurried Blu00FAz","http://starshiners.hu/bluzok/nude-prettygirl-unhurried-bluz",8990.0
"Fehu00E9r StarShinerS Brodata Innovative Blu00FAz","http://starshiners.hu/bluzok/feher-starshiners-brodata-innovative-bluz",7990.0
"Nude LaDonna Natural Vibe Blu00FAz","http://starshiners.hu/bluzok/nude-ladonna-natural-vibe-bluz",8690.0
"Mint PrettyGirl Covered Blu00FAz","http://starshiners.hu/bluzok/mint-prettygirl-covered-bluz",6706.5
"Fehu00E9r PrettyGirl Covered Blu00FAz","http://starshiners.hu/bluzok/feher-prettygirl-covered-bluz",6706.5
"Fehu00E9r PrettyGirl Definite Blu00FAz","http://starshiners.hu/bluzok/feher-prettygirl-definite-bluz",6013.0
"Fekete PrettyGirl Effusion Blu00FAz","http://starshiners.hu/bluzok/fekete-prettygirl-effusion-bluz",7106.0
"Pink PrettyGirl Plentiful Blu00FAz","http://starshiners.hu/bluzok/pink-prettygirl-plentiful-bluz",10180.0
"Zu00F6ld Perfect Jewels Blu00FAz","http://starshiners.hu/bluzok/zold-perfect-jewels-bluz",8480.0
"Pink Perfect Jewels Blu00FAz","http://starshiners.hu/bluzok/pink-perfect-jewels-bluz",8480.0
"Nude PrettyGirl Distinctiv Blu00FAz","http://starshiners.hu/bluzok/nude-prettygirl-distinctiv-bluz",11570.0
"Piros LaDonna Frosty Elegance Ing","http://starshiners.hu/ingek/piros-ladonna-frosty-elegance-ing",9620.0
"Lila PrettyGirl Released Blu00FAz","http://starshiners.hu/bluzok/lila-prettygirl-released-bluz",5432.0
"Fehu00E9r LaDonna First Concept Blu00FAz","http://starshiners.hu/bluzok/feher-ladonna-first-concept-bluz",7580.0
"Nude LaDonna First Concept Blu00FAz","http://starshiners.hu/bluzok/nude-ladonna-first-concept-bluz",7580.0
"Szu00FCrke PrettyGirl First Life Blu00FAz","http://starshiners.hu/bluzok/szurke-prettygirl-first-life-bluz",7620.0
"Fehu00E9r PrettyGirl Viva Chic Blu00FAz","http://starshiners.hu/bluzok/feher-prettygirl-viva-chic-bluz",5145.0
"Fekete PrettyGirl Viva Chic Blu00FAz","http://starshiners.hu/bluzok/fekete-prettygirl-viva-chic-bluz",5145.0
"Burgundy PrettyGirl Pearled Blu00FAz","http://starshiners.hu/bluzok/burgundy-prettygirl-pearled-bluz",8610.0
"Su00F6tu00E9tbarna PrettyGirl Viva Chic Blu00FAz","http://starshiners.hu/bluzok/sotetbarna-prettygirl-viva-chic-bluz",5145.0
"Ku00E9k PrettyGirl Pearled Blu00FAz","http://starshiners.hu/bluzok/kek-prettygirl-pearled-bluz",8610.0
"Mint PrettyGirl Pearled Blu00FAz","http://starshiners.hu/bluzok/mint-prettygirl-pearled-bluz",8610.0
"Su00F6tu00E9tku00E9k PrettyGirl Pearled Blu00FAz","http://starshiners.hu/bluzok/sotetkek-prettygirl-pearled-bluz",8610.0
"Korall PrettyGirl Juicy Blu00FAz","http://starshiners.hu/bluzok/korall-prettygirl-juicy-bluz",7492.5
"Kru00E9m MissQ Flowered Affair Blu00FAz","http://starshiners.hu/bluzok/krem-missq-flowered-affair-bluz",21190.0
"Ru00F3zsaszu00EDnu0171 StarShinerS Signature Blu00FAz","http://starshiners.hu/bluzok/rozsaszinu-starshiners-signature-bluz",15590.0
"Fekete Laced Wisdom Blu00FAz","http://starshiners.hu/bluzok/fekete-laced-wisdom-bluz",5590.0
"Nude PrettyGirl Passional Blu00FAz","http://starshiners.hu/bluzok/nude-prettygirl-passional-bluz",8890.0
"Su00F6tu00E9tku00E9k LaDonna Adorable Harmony Blu00FAz","http://starshiners.hu/bluzok/sotetkek-ladonna-adorable-harmony-bluz",6790.0
"Narancs Lovely Wanderer Blu00FAz","http://starshiners.hu/bluzok/narancs-lovely-wanderer-bluz",8390.0
"Fehu00E9r LaDonna Celebrates Life Blu00FAz","http://starshiners.hu/bluzok/feher-ladonna-celebrates-life-bluz",8290.0
"Su00F6tu00E9tku00E9k Artista Calm Allure Blu00FAz","http://starshiners.hu/bluzok/sotetkek-artista-calm-allure-bluz",10490.0
"Kru00E9m Extreme Fantasy Blu00FAz","http://starshiners.hu/bluzok/krem-extreme-fantasy-bluz",7590.0
"Su00F6tu00E9tku00E9k Extreme Fantasy Blu00FAz","http://starshiners.hu/bluzok/sotetkek-extreme-fantasy-bluz",7590.0
"Fehu00E9r Imposing Whisper Blu00FAz","http://starshiners.hu/bluzok/feher-imposing-whisper-bluz",5790.0
"Kru00E9m Imposing Whisper Blu00FAz","http://starshiners.hu/bluzok/krem-imposing-whisper-bluz",5790.0
"Szu00FCrke Perfect Harmony Blu00FAz","http://starshiners.hu/bluzok/szurke-perfect-harmony-bluz",9590.0
"Fehu00E9r Exciting Moment Blu00FAz","http://starshiners.hu/bluzok/feher-exciting-moment-bluz",10390.0
"Piros Exciting Moment Blu00FAz","http://starshiners.hu/bluzok/piros-exciting-moment-bluz",10390.0
"Fekete LaDonna Peaceful Mind Blu00FAz","http://starshiners.hu/bluzok/fekete-ladonna-peaceful-mind-bluz",10490.0
"Fehu00E9r LaDonna Peaceful Mind Blu00FAz","http://starshiners.hu/bluzok/feher-ladonna-peaceful-mind-bluz",10490.0
"Burgundy LaDonna Peaceful Mind Blu00FAz","http://starshiners.hu/bluzok/burgundy-ladonna-peaceful-mind-bluz",10490.0
"Fehu00E9r StarShinerS Perfumed Blu00FAz","http://starshiners.hu/bluzok/feher-starshiners-perfumed-bluz",12290.0
"Ku00E9k StarShinerS Perfumed Blu00FAz","http://starshiners.hu/bluzok/kek-starshiners-perfumed-bluz",12290.0
"Nude StarShinerS Perfumed Blu00FAz","http://starshiners.hu/bluzok/nude-starshiners-perfumed-bluz",12290.0
"Arany MissQ Inviting Words Blu00FAz","http://starshiners.hu/bluzok/arany-missq-inviting-words-bluz",10990.0
"Fehu00E9r MissQ Natural Shine Blu00FAz","http://starshiners.hu/bluzok/feher-missq-natural-shine-bluz",10990.0
"Tu00FCrkiz MissQ Natural Shine Blu00FAz","http://starshiners.hu/bluzok/turkiz-missq-natural-shine-bluz",10990.0
"Fekete MissQ City Trend Blu00FAz","http://starshiners.hu/bluzok/fekete-missq-city-trend-bluz",16490.0
"Kru00E9m MissQ Hard Way Blu00FAz","http://starshiners.hu/bluzok/krem-missq-hard-way-bluz",9890.0
"Fehu00E9r LaDonna Graceful Behave Blu00FAz","http://starshiners.hu/bluzok/feher-ladonna-graceful-behave-bluz",9690.0
"Su00E1rga LaDonna Graceful Behave Blu00FAz","http://starshiners.hu/bluzok/sarga-ladonna-graceful-behave-bluz",9690.0
"Zu00F6ld LaDonna Graceful Behave Blu00FAz","http://starshiners.hu/bluzok/zold-ladonna-graceful-behave-bluz",9690.0
"Su00F6tu00E9tku00E9k LaDonna Graceful Behave Blu00FAz","http://starshiners.hu/bluzok/sotetkek-ladonna-graceful-behave-bluz",9690.0
"Fehu00E9r LaDonna Sweet Infusion Ing","http://starshiners.hu/bluzok/feher-ladonna-sweet-infusion-ing",13690.0
"Piros LaDonna Strong Value Ing","http://starshiners.hu/bluzok/piros-ladonna-strong-value-ing",9390.0
"Piros LaDonna Sweet Infusion Ing","http://starshiners.hu/bluzok/piros-ladonna-sweet-infusion-ing",13690.0
"Su00F6tu00E9tku00E9k LaDonna Strong Value Ing","http://starshiners.hu/bluzok/sotetkek-ladonna-strong-value-ing",9390.0
"Lila LaDonna Strong Value Ing","http://starshiners.hu/bluzok/lila-ladonna-strong-value-ing",9390.0
"Fekete MissQ Favorite Design Blu00FAz","http://starshiners.hu/bluzok/fekete-missq-favorite-design-bluz",17290.0
"Kru00E9m MissQ Favorite Design Blu00FAz","http://starshiners.hu/bluzok/krem-missq-favorite-design-bluz",17290.0
"Zu00F6ld MissQ Graphic Crowd Blu00FAz","http://starshiners.hu/bluzok/zold-missq-graphic-crowd-bluz",17090.0
"Fehu00E9r MissQ Hot Treasure Ruha","http://starshiners.hu/bluzok/feher-missq-hot-treasure-ruha",13990.0
"Burgundy Extreme Fantasy Blu00FAz","http://starshiners.hu/bluzok/burgundy-extreme-fantasy-bluz",7590.0
"Nude Daniella Cristea Flowered Blu00FAz","http://starshiners.hu/bluzok/nude-daniella-cristea-flowered-bluz",21490.0
"Fekete Delicious Shade Blu00FAz","http://starshiners.hu/bluzok/fekete-delicious-shade-bluz",15990.0
"Kru00E9m MissQ True Flame Blu00FAz","http://starshiners.hu/bluzok/krem-missq-true-flame-bluz",14190.0
"Fehu00E9r LaDonna Rustic Simpathy Blu00FAz","http://starshiners.hu/bluzok/feher-ladonna-rustic-simpathy-bluz",10990.0
"Su00F6tu00E9tzu00F6ld PrettyGirl Reborn Blu00FAz","http://starshiners.hu/bluzok/sotetzold-prettygirl-reborn-bluz",6490.0
"Nude LaDonna Precious Taste Blu00FAz","http://starshiners.hu/bluzok/nude-ladonna-precious-taste-bluz",10490.0
"Su00F6tu00E9tku00E9k LaDonna Precious Taste Blu00FAz","http://starshiners.hu/bluzok/sotetkek-ladonna-precious-taste-bluz",10490.0
"Szu00FCrke MissQ Hard Way Blu00FAz","http://starshiners.hu/bluzok/szurke-missq-hard-way-bluz",9890.0
"Szu00FCrke MissQ Love Affair Blu00FAz","http://starshiners.hu/bluzok/szurke-missq-love-affair-bluz",16490.0
"Fehu00E9r LaDonna Perfect Style Blu00FAz","http://starshiners.hu/bluzok/feher-ladonna-perfect-style-bluz",9290.0
"Piros LaDonna Perfect Style Blu00FAz","http://starshiners.hu/bluzok/piros-ladonna-perfect-style-bluz",9290.0
"Barackviru00E1gszu00EDnu0171 LaDonna Perfect Style Blu00FAz","http://starshiners.hu/bluzok/barackviragszinu-ladonna-perfect-style-bluz",9290.0
"Zu00F6ld LaDonna Perfect Style Blu00FAz","http://starshiners.hu/bluzok/zold-ladonna-perfect-style-bluz",9290.0
"Lila Pure Radiance Blu00FAz","http://starshiners.hu/bluzok/lila-pure-radiance-bluz",15990.0
"Su00F6tu00E9tszu00FCrke Top Secret Fast Time Blu00FAz","http://starshiners.hu/bluzok/sotetszurke-top-secret-fast-time-bluz",9290.0
"Szu00FCrke Top Secret Warm Journey Blu00FAz","http://starshiners.hu/bluzok/szurke-top-secret-warm-journey-bluz",6490.0
"Nude Top Secret Warm Journey Blu00FAz","http://starshiners.hu/bluzok/nude-top-secret-warm-journey-bluz",6490.0
"Fehu00E9r Graceful Look Ruha","http://starshiners.hu/bluzok/feher-graceful-look-ruha",12790.0
"Fehu00E9r MissQ Absolute Passion Blu00FAz","http://starshiners.hu/bluzok/feher-missq-absolute-passion-bluz",15290.0
"Fekete MissQ Deep Limits Blu00FAz","http://starshiners.hu/bluzok/fekete-missq-deep-limits-bluz",14190.0
"Piros MissQ Fancy Discover Blu00FAz","http://starshiners.hu/bluzok/piros-missq-fancy-discover-bluz",16390.0
"Kru00E9m MissQ Casual Concept Blu00FAz","http://starshiners.hu/bluzok/krem-missq-casual-concept-bluz",17490.0
"Fekete LaDonna Rustic Simpathy Blu00FAz","http://starshiners.hu/bluzok/fekete-ladonna-rustic-simpathy-bluz",10990.0
"Su00F6tu00E9tku00E9k LaDonna Rustic Simpathy Blu00FAz","http://starshiners.hu/bluzok/sotetkek-ladonna-rustic-simpathy-bluz",10990.0
